{
  "emitter_id": "CARMONEY",
  "name": "ПАО «КарМани»",
  "inn": "7719451419",
  "industry_group": 2,
  "period": {
    "period_type": "annual",
    "label": "2025",
    "date_from": "2025-01-01",
    "date_to": "2025-12-31",
    "report_date": "2026-03-31"
  },
  "source": {
    "provider": "e-disclosure.ru",
    "company_id": "8657",
    "document_url": "https://www.e-disclosure.ru/portal/files.aspx?id=8657&type=3",
    "document_type": "accounting_report",
    "reporting_standard": "rsbu",
    "file_format": "pdf",
    "downloaded_at": "2026-04-21T08:15:00+03:00",
    "parser_version": "0.1.0"
  },
  "statements": {
    "balance": {
      "1200": {
        "value": 1542000000.0,
        "label": "Оборотные активы",
        "unit": "RUB",
        "source": "balance"
      },
      "1210": {
        "value": null,
        "label": "Запасы",
        "unit": "RUB",
        "source": "balance"
      },
      "1240": {
        "value": 95000000.0,
        "label": "Финансовые вложения (краткосрочные)",
        "unit": "RUB",
        "source": "balance"
      },
      "1250": {
        "value": 318000000.0,
        "label": "Денежные средства и эквиваленты",
        "unit": "RUB",
        "source": "balance"
      },
      "1300": {
        "value": 640000000.0,
        "label": "Итого капитал и резервы",
        "unit": "RUB",
        "source": "balance"
      },
      "1410": {
        "value": 450000000.0,
        "label": "Долгосрочные заёмные средства",
        "unit": "RUB",
        "source": "balance"
      },
      "1500": {
        "value": 980000000.0,
        "label": "Итого краткосрочные обязательства",
        "unit": "RUB",
        "source": "balance"
      },
      "1510": {
        "value": 390000000.0,
        "label": "Краткосрочные заёмные средства",
        "unit": "RUB",
        "source": "balance"
      },
      "1600": {
        "value": 2340000000.0,
        "label": "Валюта баланса (итог активов)",
        "unit": "RUB",
        "source": "balance"
      }
    },
    "income_statement": {
      "2110": {
        "value": 1285000000.0,
        "label": "Выручка",
        "unit": "RUB",
        "source": "income_statement"
      },
      "2200": {
        "value": 214000000.0,
        "label": "Прибыль от продаж",
        "unit": "RUB",
        "source": "income_statement"
      },
      "2330": {
        "value": 126000000.0,
        "label": "Проценты к уплате",
        "unit": "RUB",
        "source": "income_statement"
      },
      "2400": {
        "value": 97000000.0,
        "label": "Чистая прибыль (убыток)",
        "unit": "RUB",
        "source": "income_statement"
      }
    },
    "cashflow": {
      "4110": {
        "value": 2100000000.0,
        "label": "Поступления от текущих операций",
        "unit": "RUB",
        "source": "cashflow"
      },
      "4120": {
        "value": 1914000000.0,
        "label": "Платежи по текущим операциям",
        "unit": "RUB",
        "source": "cashflow"
      },
      "4100": {
        "value": 186000000.0,
        "label": "Чистые ДС от текущих операций (CFO)",
        "unit": "RUB",
        "source": "cashflow"
      },
      "4220": {
        "value": 54000000.0,
        "label": "Платежи на приобретение внеоборотных активов (CAPEX)",
        "unit": "RUB",
        "source": "cashflow"
      }
    },
    "prev_period": {
      "period_label": "2024",
      "2110": {
        "value": 1020000000.0,
        "label": "Выручка 2024",
        "unit": "RUB",
        "source": "income_statement"
      },
      "2400": {
        "value": 75000000.0,
        "label": "Чистая прибыль 2024",
        "unit": "RUB",
        "source": "income_statement"
      },
      "4100": {
        "value": 142000000.0,
        "label": "CFO 2024",
        "unit": "RUB",
        "source": "cashflow"
      }
    },
    "notes": {
      "amortization": {
        "value": null,
        "label": "Амортизация",
        "unit": "RUB",
        "source": "notes"
      },
      "interest_income": {
        "value": 950000000.0,
        "label": "Процентные доходы",
        "unit": "RUB",
        "source": "notes"
      },
      "npl_90_plus": {
        "value": 143000000.0,
        "label": "Просрочка 90+",
        "unit": "RUB",
        "source": "notes"
      },
      "loan_loss_reserves": {
        "value": 151000000.0,
        "label": "Резервы под обесценение",
        "unit": "RUB",
        "source": "notes"
      },
      "nmfk1_ratio": 4.2,
      "leasing_portfolio_net": {
        "value": null,
        "label": "Лизинговый портфель нетто",
        "unit": "RUB",
        "source": "notes"
      },
      "lease_payments_received": {
        "value": null,
        "label": "Лизинговые платежи полученные",
        "unit": "RUB",
        "source": "notes"
      },
      "escrow_balance": {
        "value": null,
        "label": "Остаток на счетах эскроу",
        "unit": "RUB",
        "source": "notes"
      },
      "project_finance_debt": {
        "value": null,
        "label": "Задолженность по ПФ",
        "unit": "RUB",
        "source": "notes"
      },
      "overdue_portfolio": {
        "value": null,
        "label": "Просроченный портфель",
        "unit": "RUB",
        "source": "notes"
      }
    }
  },
  "normalized_metrics": {
    "assets_current": 1542000000.0,
    "inventory": null,
    "short_term_financial_investments": 95000000.0,
    "cash": 318000000.0,
    "liabilities_short": 980000000.0,
    "ebit": 214000000.0,
    "interest_expense": 126000000.0,
    "equity": 640000000.0,
    "debt_long": 450000000.0,
    "debt_short": 390000000.0,
    "assets_total": 2340000000.0,
    "ebitda": null,
    "amortization": null,
    "revenue": 1285000000.0,
    "profit_sales": 214000000.0,
    "net_profit": 97000000.0,
    "revenue_prev": 1020000000.0,
    "cfo": 186000000.0,
    "capex": 54000000.0,
    "fcf": 132000000.0,
    "cfo_prev": 142000000.0,
    "escrow_balance": null,
    "project_finance_debt": null,
    "npl_90_plus": 143000000.0,
    "loan_loss_reserves": 151000000.0,
    "nmfk1_ratio": 4.2,
    "interest_income": 950000000.0,
    "leasing_portfolio_net": null,
    "lease_payments_received": null,
    "overdue_portfolio": null
  },
  "coverage_flags": {
    "has_balance": true,
    "has_income_statement": true,
    "has_cashflow": true,
    "has_notes": true,
    "has_prev_period": true,
    "has_required_core_metrics": false,
    "missing_critical_metrics": [
      "inventory",
      "ebitda",
      "amortization"
    ],
    "ebitda_approximated": true,
    "used_ifrs_fallback": false,
    "data_missing_penalty": true,
    "revenue_quality_risk": false,
    "industry_notes_required": true,
    "industry_notes_missing": false
  },
  "parser_notes": [
    "Амортизация не выделена в пояснениях — EBITDA = None, флаг ebitda_approximated=true. В kfi_calculator.py будет использован proxy: EBIT (стр. 2200).",
    "Для группы 2 (МФО) найдены NPL 90+ и резервы — блок A рассчитывается по специальным нормам.",
    "НМФК1 = 4.2% — ниже порога ЦБ 6%. Предупреждение передаётся в kfi_calculator.py.",
    "Строка 1210 (Запасы) = None — для МФО не критично, ликвидность по группе 2 считается иначе.",
    "Активирован штраф data_missing_penalty: 3 критических поля null (inventory, ebitda, amortization)."
  ]
}